{
  "task_id": "test-proto-workflow-001",
  "description": "Test workflow PROTO - Créer une fonction Python simple avec validation",
  "steps": [
    {
      "id": "step_1",
      "description": "Créer une fonction Python qui calcule la factorielle d'un nombre",
      "type": "code_generation",
      "complexity": 0.3,
      "estimated_tokens": 300,
      "dependencies": [],
      "validation_criteria": [
        "Fonction nommée 'factorial'",
        "Prend un paramètre 'n' (int)",
        "Retourne la factorielle de n",
        "Gère le cas n=0 et n=1"
      ],
      "context": {
        "language": "python",
        "framework": "",
        "files": []
      }
    }
  ],
  "metadata": {
    "created_at": "2025-01-26T12:00:00Z",
    "claude_version": "claude-code",
    "project_context": "Test workflow PROTO avec validation DOUBLE-CHECK"
  }
}
